sceneId,prevId,areaId,animation,text,option1Id,option1Txt,option1NextId,option2Id,option2Txt,option2NextId,option3Id,option3Txt,option3NextId
90,"89, 113",3,,You hear the caw or bark of some huge creature high above the canopy.,271,Turn left,91,272,Turn right,91,273,,
91,"88, 90",3,./Assets/gifs/figure.gif,A face appears in your minds eye. It's too fast to make sense of.,274,Turn left,93,275,Turn right,94,276,,
92,"91, 94",3,,"""WARMER"" A shrill shriek erupts from above somewhere, and you immediately can smell....smoke.",277,Turn left,97,278,Turn right,98,279,,
93,"91, 109, 110",3,,"You feel like someones behind you, but when you look there's nothing but woodland.",280,Turn left,94,281,Turn right,94,282,,
94,"93, 109",3,,You hear the mock roar of a lion followed by laughter.,283,Turn left,95,284,Turn right,92,285,,
95,"111, 93, 94",3,,"You hear a voice in your mind, beginning quiet and crescendoing into a screech. It says ""Trees, trees, trees, trees, TREES, TREES, TREES! How lost do you have to be to see no forest for the trees!""",286,Turn left,96,287,Turn right,93,288,,
96,95,3,,"You suddenly feel a sense of brief relief, like a glowing sensation. Ahead of you, behind a bramble bush, you see a figure, just for a moment. It looked a lot like you...which brings to your attention that the you that's running around this maze doesn't have a body. The you you're controlling now can feel the grass beneath their feet but has no feet.",289,Turn left,108,290,Turn right,113,291,,
97,"93, 109",4,,The smell of bonfires is unmistakable. It's coming from the right.,292,Turn left,99,293,Turn right,100,294,,
98,92,4,,"""Yes yes YES"" Your mind aches with these invasive voices, the mind you carry without a skull, without a body, somehow still preserving the ancient hell of a headache. ""Another one filled to the brim with aimless curiousity. Split into many. Fractured""",295,Up,101,296,Down,101,297,Forward,101
99,97,3,./Assets/gifs/figure.gif,"You reach a dead end of brambles, and behind you recognise the beginning of the maze, unreachable. On the other side, someone who looks a lot like you gazes, stunned, before moving on. You hear laughter.",298,Turn left,109,299,Turn right,97,300,,
100,97,4,./Assets/gifs/fire.gif,"You see an almighty fire in a clearing. Its surrounded by dancing sprites like the one you saw at the entrance to the maze. The flame reaches high into the sky, emitting a column of jet black smoke that reaches out of view. The flares that occasionally breach the main fire brush the merry cultists, but none seem affected.",301,Try to get closer,"103,104",302,Try to fly away,107,303,,
101,98,4,,"""Why would anyone walk a maze? To find the joy of losing their way! The final path? The final flame that sweeps all paths away."" Your being is wracked with pain, ""and when it knocks, what will you say? You have no choice:""",304,I shall obey,102&,305,,,306,,
102,"101, 106",4,./Assets/gifs/fire.gif,"You drift towards a mighty bonfire. Below you are chanting creatures, monsters of all sordid shapes, leaping and screaming with glee as you rise into the flames. A shadow of your former body appears in front of you. You experience one brief glance at your limbs,  before becoming one with the flames. You don’t know why you came here, only that you are now one with the elemental flame, free to ignite all paths, all planes, with mindless and necessary destruction.",307,,<l>,308,,<l>,309,,<l>
103,100,4,./Assets/gifs/dice.gif,"You see chanting creatures, monsters of all sordid shapes, leaping and screaming with glee as a figure is lifted into the fire. It looks like a man, but completely still, compliant, or paralysed.",310,Get closer,104,311,Run,105,312,,
104,"100, 103",4,./Assets/gifs/dice.gif,"As you creep closer, you suddenly hear the snap of a branch. Looking around for the source, to your horror, you realise it was you who made the noise. You look up to see a host of creatures meeting your gaze, all grinning with devilish excitement.",313,Run,"105, 106",314,,,315,,
105,"103, 104, 107",4,,Do you remember the way out?,316,"Left, right, left, left, left, left",112&,317,"Left, right, right, left, left, right",106,318,"Right, left, right, right, left, left, right",106
106,"104, 105",4,,"You launch into the woods, tailed by a chorus of yells and gargling cheers, screams paired with the thumping of feet on soil. You turn the way you thought made sense, but it quickly becomes nonsense. ""Trees, trees, trees, trees, TREES, TREES, TREES! How lost do you have to be to see no forest for the trees!"" You reach a wall of brambles, a dead end. On the other side you see your old body staring back at you. He says 'I'm sorry' as you are dragged back to the fire.",319,Help me!,102&,320,,,321,,
107,100,4,,"As you ascend, the trees stretch further and further, like a never ending corridoor that goes up and up.",322,Run,105,323,,,324,,
108,96,3,y,"You see a note on the floor. It says ‘If you reach them, you’ll need this, a friend. Left, right, left, left, left, left’ As you go to pick it up, the leaves and vines rise up to cover it. Seems like you’ll have to remember it. Maybe even write it down....",325,Turn left,109,326,,,327,,
109,"99, 108",3,,Trees stretch towards the sky. Laughter sometimes echos in the distance.,328,Turn left,110,329,Turn right,93,330,,
110,109,3,,"You see a puddle on the ground surrounded by smoke. When you look into it, you see your former body, but you can’t see it in person. You wonder what it means.",331,Turn right,93,332,,,333,,
111,14,3,,"Before you can do anything, the creature darts off with impressive speed. A great maze of trees lies before you. It doesn’t feel...safe. With each choice, you must be committed. Are you sure you want to go in?",334,Head back the other direction,"3,2",335,"Go in, turn left",87,336,"Go in, turn right",95
112,105,3,./Assets/gifs/ending.gif,"Miraculously, weaving and turning through the woods, trailed by evil laughter, you see the entrance to the trees, and in it, a figure on the path. As you draw near, you realise, it's not a figure, it's your figure, your body walking around. He looks at you, as your orb self, and places a note kindly on the ground. He then holds out his hand: 'Come on,' he says, 'we've got much work to do.' And you do; without hesitation, for reasons known only deep in your soul core, you rejoin the body, and return to your post-life directive. You will save lost souls from this cursed woodland. You will save whoever you can find, and whoever finds you.",337,,<w4>,338,,<w4>,339,,<w4>
113,96,3,,"You see a note on the floor, and as you touch it, you are filled with your previous sense of lightness...you realise that this may be your only chance to leave the maze, at least for a while. That said, you have no answers yet.",340,Leave the woods,114,341,Step back inside,87,342,,
114,113,3,,"You feel a great sense of relief, but you know in your heart that more lies hidden in those woods, should it be your path.",343,Explore the rest of the areas,"2,3",344,,,345,,
115,86,86,,"She smiles, but it is not one of peace. The song around you becomes a wall of sound, deafening where it was once soothing. Her silver eyes burn like planets in the void, and all the water around you begins to swirl into them. You are struck with horror, knowing that in the end, you could not see the truth, the truth of the passing of all things. The boatman looks on, apathetic, as the water pulls you into the center of her eyes, helpless and lost. For now, you become another question unanswered in the halls of her legendary mind.",346,,<l>,347,,<l>,348,,<l>