sceneId,prevId,areaId,animation,text,option1Id,option1Txt,option1NextId,option2Id,option2Txt,option2NextId,option3Id,option3Txt,option3NextId
0,0,0,,"All is dark. You float on a sea of nothingness with no knowledge of who,when and where you are.",1,,,2,Open your eyes,1,3,,1
1,0,0,,"You open your eyes to a blank sea of distant gleams. You feel weightless, like theres no gap between you and the space around you. Where were you before this you think...it's hard to imagine anything before this. As you continue to gaze, you see three distinct shapes in the distance, though what they represent is still unclear",4,Move towards the left,2,5,Go straight ahead,3,6,Move towards the right,4
2,1,1,./Assets/gifs/dice.gif,"You see what looks like...a giant telescope,  with banners of gold around the elipses, poking through the roof of a structure. It has a globe like roof, but the base seems to stretch downwards for eternity. The rims of both the orb and the telescope have runic lettering you don't understand. but you can clearly see the viewing glass shine through a small gap in the doorway. ",7,Look another direction.,"3,4",8,Go into the building to look through the looking glass,5,9,Look towards the base of the building,11
3,1,2,./Assets/gifs/dice.gif,"You see a great sphere of water, like a planet made entirely of ocean, only it undulates and crashes like in a permanent storm. There is one exception to this movement; a calm sliver like a stream that seems to stretch out into the vast beyond. Its mouth seems to be somewhere on the surface of the globe, but its very hard to see.",10,Look another direction.,"2,4",11,Take a closer look,52,12,,
4,1,3,./Assets/gifs/dice.gif,"You see a forest erupt from a great floating land mass, like an upturned mountain with a billion green feet on its belly. Even from a distance, you can see some force working on the trees: not wind, but perhaps, animals of some kind?",13,Look another direction.,"2,3",14,Take a closer look,14,15,,
5,2,1,,"You look through the telescope to see what look like smoke rings, eminating up from an imaginary mouth in the darkness. They appear to form a slanted invisible rising column",16,Try to zoom in closer,6,17,Try to move the telescope to look around,7,18,Leave the telescope,10
6,5,1,,"The smoke rings seem to be made up of spirits, or people, or the shape of either, it's hard to tell. Sometimes you see a swimming mermaid like shape, next just a speaking mouth; it's always shifting",19,Leave the telescope,10,20,Try to move the telescope to look around,7,21,,
7,"5, 6",1,,"It's huge, and won't easily budge",22,Leave the telescope,10,23,Look for another way to move it,"8,9",24,,
8,7,1,,You find nothing of note,25,Go back,7,26,,,27,,
9,7,1,./Assets/gifs/dice.gif,"You glance around the sparce room, and, out from under a pile of papers depicting more runes, you see the gleam of an old-timey compass. As you touch it, the arrow leans, and the telescope follows the same direction. It's like it knew what you were trying to do. Looking through the lense, you see a dark shape block out the rings for a second. It looks like...a giant crow? It must be at least 30ft across!",28,Leave the telescope,10,29,,,30,,
10,"6,7,8,9, 15 ",1,,"Now that you've seen what's out there, you know what you've got to do! ",31,Head towards the rings.,12,32,,,33,,
11,2,1,,"You look down but there's no end in sight, like looking at a dot that beams out the building like a ray of light from infinite distance",34,Go back,2,35,,,36,,
12,10,1,,"As you step out into the dark again, you realise, your powers of flight are limitless:  you choose a direction, and you go go go. What are you? You still feel like you, but  sense doesn't seem to be a part of it",37,Keep going towards the rings,15,38,Fly into the void,16,39,Fly back the way you came,13
13,12,1,,"Swooping, diving, whizzing around with no body but somehow a feeling of fun, you see the shapes from before, but now you can take sweeping looks. One is a great ball of water with a single stream that also dissappears into the distance. The other looks like a floating land mass covered in trees",40,Fly down to the ocean,52,41,Fly down to the forest,14,42,Fly into the endless void,16
14,"13, 43, 75",3,./Assets/gifs/goblin.gif,"The trees stretch on forever, both in front of you but also above you, like the canopy is now unreachable. You look straight ahead at the mouth of the woodland to see a small, mischevious looking creature bearing a wide grin : ""Catch me,  if you dare!""",43,Who are you?,111,44,What are you?,111,45,Go towards it,111
15,12,1,y,"You approach the rings. Up close they're even more etherial and gasseous, but so vast they look like rings of saturn. On top of the spirit-built structure there are seemingly more human, more solid looking people, either dancing gleefully above them, or looking deeply into the center",46,Fly past the rings into the darkness,16,47,Fly into the group of people,19,48,,
16,"12, 15, 17",1,,"You drift through an endless void it takes a while! As you persist, the star like glows begin to fade away, leaving nothing but murky darkness with the odd grey polkadot on its surface",49,Keep going,17,50,Go back towards the rings,15,51,,
17,"16, 18",1,,Darkness. Nothing. Apart from...what's that noise?,52,Keep going,18,53,Turn back,16,54,,
18,17,1,,"It sounds like an almighty bark, or...caw ? You're definitely getting closer",55,Keep going,51&,56,Turn back,17,57,,
19,15,1,,You are greeted by many waving hands and smiling faces. A welcome party of people you've never seen before beckon you down to the spirit coastline,58,Look into the centre of the ring,21,59,Go towards the people,20,60,Touch the smoke ring,30
20,"19,21, 30",1,,"""Welcome! How was the transition? Are you ready to follow the path to your next life?""",61,Next life...?,26,62,Look into the rings,21,63,,
21,"19, 30",1,,"You see yet another vast universe below, but this is more clustered, like a single galaxy floating in the dark",64,Touch the smoke rings,30,65,Go towards the enclosed galaxy,"23&,24",66,Greet the people,20
22,"23, 24, 28",1,,"As you reach the skin between the current void and the next, you feel a rush of darkness surround you, and where you felt weightless before, you suddenly feel heavy, as you are gulped down into the monsterous belly of some shadowy beast...",67,,<l>,68,,<l>,69,,<l>
23,21,1,,"You drift foward, and begin to hear the beating of giant wings. You have a brief moment to react.",70,Turn back,25,71,Push forward,22&,72,,
24,21,1,,"You hear people calling again, but this time more urgent and panicked. You see an enormous winged shadow descending towards you",73,Push forward,22,74,Turn back,25,75,,
25,"23,24",1,,"You launch yourself back towards the edges just as two black talons grasp the space you once were. You realise in this moment you can emit noises, since you find yourself yelping with fear. You turn to the onlookers ""what was that thing? A kind looking woman replied: 'Oh it's the guardian, but don't feel embarrassed. One or other person does the same thing now and again. It's not a monster, we've learned. It's there to make sure you don't reach your next life until you're ready, and also apparently brings people here too, from Earth I mean.""",76,Next life...?,26,77,,,78&,,
26,"20, 25",1,,"""Oh honey,"" you see a look of resignation in her so-very-human eyes, like she's had this conversation many times before. ""You've...passed on. This is the afterlife. Whatever happened on earth...has led you here.""",79,You don't know what to say,29,80,That makes sense,27,81,Freak out,28
27,26,1,,"""You're handling it fantastically well, especially since you can't even see your body again yet!"" She smiles. ""That is the way back down there, but there's one step before you can take that path.""",82,I get to go back?,31,83,,,84,,
28,26,1,,"""It's ok it's ok!"" People start to flock around you in an attempt to comfort and calm. ""Many of us reacted the same way! It's a lot to take in.""",85,You don't know what to say,29,86,Try to escape through the ring,22&,87,,
29,"26, 28",1,,"""It's a lot, I'm very aware"" she smiles, sympathetic. ""Let me help you. You can't just jump into the pool, but you can look into the water, so to speak, and that's really the last step towards getting in there, simple as it sounds.""",88,Look?,31,89,,,90,,
30,"19, 21",1,,"Spirits breeze through your fingers without care, and you can see more clearly a range of emotions and movements represented in the shades.",91,Greet the people,19,92,Look into the centre of the rings,21,93,,
31,"27,29",1,,"""If you look into the pool, you'll see what you know as your former life. If you can face it and answer the questions it poses honestly, you'll be ready to embark on your next life on earth. If you can't, well you're kind of here until you can. The only alternative we've ever seen is stealing a feather from the crow to bypass the guardrails, but that's extremely risky, and we don't know what kind of life waits for you if you succeed. Well...what would you like to do?""",94,Look into the pool,32,95,Go after the crow feather.,45,96,,
32,31,1,,"As you gaze into the ring, nothing happens at first. However, the longer you look, the more the surface seems to glisten and ripple. You see your face. You are:",97,img,33,98,img,34,99,img,35
33,32,1,,"Of course, it seems so clear now. Your body instantly forms around you and you feel your full self again. ",100,Look deeper into the pool,36,101,,,102,,
34,32,1,,"Yes, yes, you feel your body form around you, and you suddenly feel your full self again. ",103,Look deeper into the pool,36,104,,,105,,
35,32,1,,"Yes, an animal of some kind, perhaps a cat or dog? Budgie or badger? ",106,Cat,36,107,Budgie,36,108,Badger,36
36,"33, 34, 35",1,,"Your life rushes through you like a film projected into every molecule,  a cosmic zoetrope. If you could describe yourself in a few words, what would the be?",109,Kind,37,110,Strong,37,111,Fluffy,37
37,36,1,,"Yes, of course, that makes sense. If you could change one thing, what would it be?",112,Worry less,38,113,Live more,38,114,Eat more treats,38
38,37,1,,"No creature has lived a perfect life, not even those who are enlightened. So in your next life, you need to?",115,Explore the world,39,116,Change the world,39,117,Have more fun than the whole world,39
39,38,1,,"Sounds like you know who you are, where you've been, and where you're going.",118,I guess so...,40,119,,,120,,
40,39,1,,So... are you ready to pass on?,121,It's time,43&,122,No..I'm not sure I am,41,123,,
41,40,1,,"You return to your senses, now in your former body, and are met with the onlookers, who seem to know exactly what your feeling, even though they ask ""What's on your mind?""",124,"You change your mind: 'You know what, I think I'm ready to go back.'",42&,125,I'm just not ready to go. I wish to stay here a while...,43&,126,,
42,40,1,y,"You gaze into the pool, and on cue, the bird lands down on the fringe, seemingly less malicious now you know its purpose. You can't help feel a slight shudder, though, as a voice eminates 'what do you wish to do?' You reply with confidence. The crow leans down to the skin of the water and gently touches it with it's beak. At once, light spreads across the surface, to the edges, across the people around you, and finally to you, as you fall, fall, fall, ready to start a new adventure.",127,,<w1>,128,,<w1>,129,,<w1>
43,42,1,,"As you glance around the circle of people, you realise that they too have made this decision, that for whatever reason, they needed a break from the world of form and facts, evolution and destruction, meaning and absurdity. Without another word, you take a few steps on the surface of the smoke, gazing at the endless array of stars and spirits you will, at least for now, call home.",130,,<w2>,131,,<w2>,132,,<w2>
44,31,1,,You are playing a game of chance from here on. Are you sure you want to continue?,133,"Yes, pursue the bird",45,134,"No, on second thought, I'm ready to find myself",31,135,,
45,44,1,,"You launch into the darkness and above the rings, surveying for any sign of movement. Before long, you see the edge of a wing in the distance. You have two ways you can do this: try and sneak up on it or attack head on. With stealth, the bird is no stranger to these attempts, so it's likely it'll catch you, but, at the same time, you're without a body and therefore slightly less noticable. If you attack, it's extremely dangerous, but it will also be the last thing it expects. What do you do?",136,Attack,47&,137,Stealth,"50&, 46",138,,
46,45,1,,"You duck and dive around its movements, and, against all odds, you are now on its back, gliding through space seemingly without any issue or recognition. You are a short pluck away from victory",139,Pluck the feather,"49&, 48",140,,,141,,
47,45,1,,"You take the bird head on, no hesitation, no surrender. As you approach, you suppose you see a glimmer of fear in his eyes, but, as it rushes towards your face, you know now it is merely the glimmer of your soul about to dissappear into its belly.  You were too defiant, too willing to abandon yourself, and guardian has set it straight. Whatever happens to you now, it will be a long time before you see light again.",142,,<l>,143,,<l>,144,,<l>
48,46,1,./Assets/gifs/dice.gif,"Gently, gently, you wrangle a single feather loose. It sails above you like a flag, the bird none the wiser. Before you can change your mind, you're descending upon the ring. The bird notices and follows, but its too late. As the bristles on the feather approach the ring the darkness becomes light, and all dissappears into it. You open your eyes, and look around. You're in your old room, but it feels different. You look down.....still no body. You try to turn on the light, but no luck. You realise then, that it is those who truly cannot accept that one life is over that they are doomed to repeat its echo across time as a lonely ghost. Things could be worse, eh? You drift around your home, since, for now, there's nothing more to be done.",145,,<l>,146,,<l>,147,,<l>
49,46,1,./Assets/gifs/dice.gif,"As the feather pops out of the crow's skin, you immediately know you've been too heavy handed. Without hesitation, the great head of the bird rockets towards you and knocks you into space. You feel for a moment you might have been left to the void, but the wings do not relent, beating ever closer until your time is lost to the mouth of the creature. You were too defiant, too willing to abandon yourself, and guardian has set it straight. Whatever happens to you now, it will be a long time before you see light again.",148,,<l>,149,,<l>,150,,<l>
50,46,1,,"The attempt is valiant, but useless. The crow knows the spirit nature well and far to many restlest souls have attempted to pluck from its coat. Without a second thought, it dives to your location and picks you out of existence, like an earth crow would pick a berry from a tree.",151,,<l>,152,,<l>,153,,<l>
51,18,1,,"As you approach the sound, it sounds pointed, sharp, like something trying to frighten you. It's so loud it seems to rattle your soul with the vibrations. The last think you see is an almighty beak lower its maw over you and swallowing you down, tiny as a snowflake to its cavenous mouth.",154,,<l>,155,,<l>,156,,<l>
52,13,2,./Assets/gifs/boat.gif,"Closer to the ocean you begin to feel a breeze, even though you don't appear to have a body to feel a breeze on.. A single wooden boat bobs on the choppy waves, painting a strange silhouette in the sea mist.",157,Get on the boat,53,158,Dive beneath the water,54,159,Follow the steam behind him,69
53,52,2,./Assets/gifs/stag.gif,"The boatman's head is nought but a deer skull, his body a weathered flag clinging to arms made of rattling twigs and stray bones. He holds a great punting pole that leads deep into the center of the water, which begins to calm, as if receiving new company.",160,Attempt to steal the boat,"58&, 59",161,Dive into the water,54,162,Try to communicate,57
54,53,2,./Assets/gifs/dive.gif,"If you’ve got no body you can’t drown, right? Down you descend with absolute ease, the water now calming completely to greet this newcomer.. You see nothing but iridescent blue and green shimmers from the still-nearby surface..",163,Keep going down,55,164,Return to the surface and speak to the boatman.,57,165,,
55,54,2,./Assets/gifs/jelly.gif,You watch as great creatures emerge: jellyfish the size of buildings with schools of fish circling and weaving through them them. You begin to feel strange inside like the weightlessness you begun with is beginning to gain some sort of substance at its core.,166,Keep going down,56&,167,Return to the surface and speak to the boatman.,57,168,,
56,55,2,,"The strange feeling grows as bright gleaming tentacles like moonbeams form pretty cages around your vision. You look down, and from your empty core, like a budding flower, strings of cyan tentacles grow evenly and outwards from you, until a jelly mushroom blooms from their effort, and you are suddenly amongst your kin, no wiser, with no desire to leave. ",169,,<l>,170,,<l>,171,,<l>
57,"53, 54",2,,"As you begin to speak, the ocean stills to a flat plane, the boat now stationary. He grunts and gurgles a few stacatto noises and points out towards the stream. You then see a ripple eminate from the surface, followed by a pair of silver human eyes; the face of a woman. A song, sweeter and more moving than anything you've ever heard, swirls in the mist.",172,Follow the stream,69,173,Speak to the woman,65,174,,
58,"53, 77, 84",2,./Assets/gifs/dice.gif,"You rush towards the creature, without a body, without leverage, and without a plan. With a grunt and swing of his gloomy antlered dome he pierces through the core of your soul For a moment, you can see into him, the strange role he has taken, and wonder what role might have found you. ",175,,<l>,176,,<l>,177,,<l>
59,"53, 84, 77",2,./Assets/gifs/dice.gif,"You rush towards the creature without a body, but your spirit is resolute. The ocean catches your emotion and sparks into a rage again, foam spluttering around the boatmans rickety form as it tries to fend you off like an invisible wasp. He gouges at you with his horns and you see your opportunity, lifting the skull from the body. The rag drops, and you are left with the boat.",178,Sail the stream,60,179,,,180,,
60,"59, 63",2,./Assets/gifs/mermaid.gif,"Your attempt to push the punting rod into the ocean fails miserably. There's no seabed to lodge the staff into. The song becomes more intense and your heart races. Behind you, the womans face emerges further from the skin of the water, revealing a visage that would catch your breathe, if you had any.",181,Step into the water,61,182,Ask the woman for help,66,183,Ask the woman who she is,65
61,60,2,./Assets/gifs/dive.gif,"As you step off the boat into the sea, you see her tail glisten every colour you could possibly imagine. Your heart feels like its stopped, this great expanse around you together, just for you. You cannot move",184,Listen to the song,62,185,Listen to the song,62,186,Listen to the song,62
62,61,2,,You drift down together like waltzing lovers on a sinking ship. The music fills every dark corner of your soul.,187,Listen...,63,188,,,189,,
63,63,2,,"The bliss begins to merge with something else, a kind of shifting in the core of your formless form. In the murky distance, you can see the drifting legs of sea behemoths and hidden monsters, schools of fish dancing in their wake. Her voice finds you 'Do you want to stay here, with me and my friends?'",190,Yes,64&,191,No,53,192,,
64,63,2,./Assets/gifs/swirl.gif,"The moment the word leaves you, the shifting escalates, and suddenly glowing arms are creeping from your core. One, two, seven, fifteen, glowing spaghetti, long and sparkling, culminating in a mushroom cap of jelly. You are suddenly amongst your kin, no wiser, with no desire to leave. The mermaid drifts away, unrecognised by your new form.",193,,<l>,194,,<l>,195,,<l>
65,"57, 64, 67, 70",2,./Assets/gifs/mermaid.gif,"She holds a blank gaze, face half in the water but you hear her words clearly, reverberating amongst the music, slow and purposeful. ‘He can’t respond with language.  He was never a living thing, just a nest of symbols with a task to complete. Whilst we have lived, however, we are no greater. Who I am is of no great use to you.'",196,Ask for help,66,197,,,198,,
66,65,2,,"""Well,"" she breathes, surrounded in song. ""Where are you going?""",199,...home?,68,200,...I think I'm....,72,201,I don't know,67
67,"66, 68, 72, 76",2,,"Then I can't help you. Even with the angelic sounds, you feel frustrated, like you're going round in circles.",202,But I need your help!,66,203,,,204,,
68,66,2,,"""And where's home?""",205,...here?,73,206,I don't know,67,207,,
69,"52, 57",2,,"As you try to swoop past, you feel a bony hand clasp around you and pull you back. It then holds out flat to you; a palm made of twig and bone, overlooked by a deer skull, gazing with empty pits for eyes. Another pair of eyes watches closely from the water.",208,What do you want?,70,209,Attempt to 'spirit low five',71,210,,
70,"69, 71",2,,"The creature grunts, whistles and gestures again. A voice climbs out of the mist 'Can you guess?'",211,Attempt to steal the boat,"58&, 59",212,Ask the voice to identify herself,65,213,,
71,69,2,,You succeed! A small twig dislodges. No one is amused.,214,What do you want?,70,215,,,216,,
72,66,2,,"""Yes?""",217,Tripping,67,218,Dreaming,67,219,Dead,73
73,72,2,./Assets/gifs/dice.gif,"""And where does death lead?""",220,....here?,"77, 73",221,...the end of that stream?,76,222,Well you tell me; where must it take me?,80
74,73,2,./Assets/gifs/dice.gif,"She looks deep into you. You seem like a confused one, and yet, you know that you are no longer alive. I believe you are wise, but I have been wrong before. Let's play a game, if you can answer my riddle, I will lead you to something that might help. But you will only get one chance. Are you ready?",223,What if I can't?,76,224,Ok I'm ready,86,225,,
75,73,2,,"""You're not wrong, I cannot fault that."" The song stops abruptly, leaving you with a sickly feeling in your belly, and alone with the ferryman, none the wiser. ",226,Leave the ocean and explore another area,"2,4",227,,,228,,
76,74,2,,"She smiles blankly, with an inhumane, uncanny beauty.",229,I guess I have no choice,86,230,,,231,,
77,73,2,./Assets/gifs/dice.gif,"""You clearly don't know where you are or where you're going. I can offer you direction."" The music swells around you.",232,Resist the song,"74, 78&",233,Give in,78&,234,,
78,77,2,./Assets/gifs/dice.gif,"The moment the thought crosses your mind, the mermaid knows she has you. She pulls you gracefully, willingly, down to the depths, past cities of jellyfish and coral, till it seems like the pressure of the ocean could grow no stronger. Your core erupts with glowing strings, topped with a cloud of jelly. You are suddenly amongst your kin, no wiser, with no desire to leave. The mermaid drifts away, unrecognised by your new form.",235,,<l>,236,,<l>,237,,<l>
79,73,2,,Would you like to stay here with me forever? With me and my friends?,238,"Resist: No, why are you doing this to me?",77,239,Yes,78&,240,,
80,73,2,,"She smiles, 'I like your spirit. Those who ask the right questions will find the way, just as I have discovered your path. So tell me, if you could, which of these is the right question?'",241,Is there a God?,84,242,Who was I when I was alive?,84,243,How do I find a coin for the boatman?,82
81,83,2,,"He takes it, and offers you a high five in return",244,"High five, head out",85&,245,,,246,,
82,"80, 86",2,y,"Her face relaxes, and you are filled with a sense of peace and autonomy, like someone put you back in your own, well, body, if you had one. She gathers you with her hands like a snowglobe and pulls you below. You see her majestic tail push gracefully through the water until you both come upon a golden speck in the ocean floor(an ocean floor that wasn't there before). She scoops it out and hands it to you. As the coin reaches your aura, the song stops abrubtly, and, without any comprehension, you are on the surface, alone with the boatman.",247,Hand over the coin,83,248,,,249,,
83,82,2,y,"The ferryman takes the penny in his hand, rolls it across his fingers, then, fully satisfied, places it in his right eye socket. It beams like a lighthouse across the stream. You see, far, far off in the distance, a vague shining structure being met with the light of his new eye. He offers you his hand again, but this time, you can see you have a hand to return to him. ",250,Head out,85&,251,Low five,81,252,,
84,80,2,,This is the wrong question....',253,But then what is the right question,74,254,,,255,,
85,"81, 83",2,./Assets/gifs/stag.gif,"You feel kinship with the ferryman, who now embarks on the journey to the next life. You were not seduced by the comforts of ignorance, and have let go of your past without losing the wisdom of your soul. The steam stays calm as ever as you drift peacefully towards the shining gates. You know you are exactly where you're meant to be.",256,,<w3>,257,,<w3>,258,,<w3>
86,"74, 76, 81",2,,"I’m not cruel, but feared I am.
I do not pick — I simply come.
I do not speak, yet write the end
Of every tale from birth to bend.
What am I?",259,The Ocean,115&,260,Death,82,261,Fate,115&
87,"111, 113",3,,You are met with endless trees. More and more and more trees every which way.,262,Turn left,89,263,Turn right,88,264,,
88,87,3,,You hear a voice above somewhere 'More trees is it? Hehehe....',265,Turn left,89,266,Turn right,91,267,,
89,"87, 88",3,,"Well would you look at that, you think, more trees. You wonder if entering this forest was such a good idea.",268,Turn left,90,269,,,270,,
